{
  "version": "perf-1",
  "workoutFile": "workouts/4-3_Upper_Body_Strength_Mobility.json",
  "timestamp": "2025-10-22T03:22:07.199Z",
  "exercises": {
    "hammer-curl": {
      "name": "Hammer Curl",
      "logType": "strength",
      "sets": [
        {
          "set": 1,
          "weight": 30,
          "multiplier": 2,
          "reps": 12,
          "rpe": 7
        },
        {
          "set": 2,
          "weight": 30,
          "multiplier": 2,
          "reps": 12,
          "rpe": 8
        },
        {
          "set": 3,
          "weight": 30,
          "multiplier": 2,
          "reps": 8,
          "rpe": 8
        }
      ]
    },
    "overhead-dumbbell-triceps-extension": {
      "name": "Overhead Dumbbell Triceps Extension",
      "logType": "strength",
      "sets": [
        {
          "set": 1,
          "weight": 35,
          "reps": 12,
          "rpe": 7
        },
        {
          "set": 2,
          "weight": 35,
          "reps": 12,
          "rpe": 8
        },
        {
          "set": 3,
          "weight": 35,
          "reps": 12,
          "rpe": 8
        }
      ]
    }
  }
}