{
  "version": "perf-1",
  "workoutFile": "workouts/4-2_Lower_Body_Strength_Mobility.json",
  "timestamp": "2025-10-14T12:13:33.467Z",
  "exercises": {
    "goblet-squat": {
      "name": "Goblet Squat",
      "logType": "strength",
      "sets": [
        {
          "set": 1,
          "weight": 65,
          "reps": 8,
          "rpe": 7
        },
        {
          "set": 2,
          "weight": 65,
          "reps": 8,
          "rpe": 7
        },
        {
          "set": 3,
          "weight": 65,
          "reps": 8,
          "rpe": 7
        }
      ]
    },
    "dumbbell-romanian-deadlift": {
      "name": "Dumbbell Romanian Deadlift",
      "logType": "strength",
      "sets": [
        {
          "set": 1,
          "weight": 65,
          "multiplier": 2,
          "reps": 8,
          "rpe": 7
        },
        {
          "set": 2,
          "weight": 65,
          "multiplier": 2,
          "reps": 8,
          "rpe": 7
        },
        {
          "set": 3,
          "weight": 65,
          "multiplier": 2,
          "reps": 8,
          "rpe": 7
        }
      ]
    },
    "bulgarian-split-squat": {
      "name": "Bulgarian Split Squat",
      "logType": "strength",
      "sets": [
        {
          "set": 1,
          "weight": 45,
          "multiplier": 2,
          "reps": 8,
          "rpe": 7
        },
        {
          "set": 2,
          "weight": 45,
          "multiplier": 2,
          "reps": 8,
          "rpe": 7
        }
      ]
    },
    "standing-calf-raise": {
      "name": "Standing Calf Raise",
      "logType": "strength",
      "sets": [
        {
          "set": 1,
          "weight": 35,
          "multiplier": 2,
          "reps": 15,
          "rpe": 7
        },
        {
          "set": 2,
          "weight": 35,
          "multiplier": 2,
          "reps": 15,
          "rpe": 7
        },
        {
          "set": 3,
          "weight": 35,
          "multiplier": 2,
          "reps": 15,
          "rpe": 7
        }
      ]
    }
  }
}