{
  "version": "perf-1",
  "workoutFile": "workouts/3-4_Upper_Body_Pump_Finisher.json",
  "timestamp": "2025-10-03T14:44:48.636Z",
  "exercises": {
    "neutral-grip-flat-bench-press": {
      "name": "Neutral-Grip Flat Bench Press",
      "logType": "strength",
      "sets": [
        {
          "set": 1,
          "weight": 40,
          "multiplier": 2,
          "reps": 10
        },
        {
          "set": 2,
          "weight": 40,
          "multiplier": 2,
          "reps": 10
        },
        {
          "set": 3,
          "weight": 40,
          "multiplier": 2,
          "reps": 10
        }
      ]
    },
    "chest-supported-dumbbell-row": {
      "name": "Chest-Supported Dumbbell Row",
      "logType": "strength",
      "sets": [
        {
          "set": 1,
          "weight": 30,
          "multiplier": 2,
          "reps": 12
        },
        {
          "set": 2,
          "weight": 30,
          "multiplier": 2,
          "reps": 12
        },
        {
          "set": 3,
          "weight": 30,
          "multiplier": 2,
          "reps": 12
        }
      ]
    },
    "incline-landmine-press": {
      "name": "Incline Landmine Press",
      "logType": "strength",
      "sets": [
        {
          "set": 1,
          "weight": 30,
          "multiplier": 2,
          "reps": 10
        },
        {
          "set": 2,
          "weight": 30,
          "multiplier": 2,
          "reps": 10
        },
        {
          "set": 3,
          "weight": 30,
          "multiplier": 2,
          "reps": 10
        }
      ]
    },
    "hammer-curl": {
      "name": "Hammer Curl",
      "logType": "strength",
      "sets": [
        {
          "set": 1,
          "weight": 30,
          "multiplier": 2,
          "reps": 12
        },
        {
          "set": 2,
          "weight": 30,
          "multiplier": 2,
          "reps": 12
        }
      ]
    },
    "overhead-triceps-extension": {
      "name": "Overhead Triceps Extension",
      "logType": "strength",
      "sets": [
        {
          "set": 1,
          "weight": 20,
          "reps": 12
        },
        {
          "set": 2,
          "weight": 30,
          "reps": 12
        }
      ]
    },
    "deadbug": {
      "name": "Deadbug",
      "logType": "strength",
      "sets": [
        {
          "set": 1,
          "weight": 10,
          "reps": 8
        },
        {
          "set": 2,
          "weight": 10,
          "reps": 8
        }
      ]
    }
  }
}