{
  "version": "perf-1",
  "workoutFile": "workouts/4-2_Upper_Body_Strength_Mobility.json",
  "timestamp": "2025-10-13T12:30:34.432Z",
  "exercises": {
    "neutral-grip-flat-bench-press": {
      "name": "Neutral-Grip Flat Bench Press",
      "logType": "strength",
      "sets": [
        {
          "set": 1,
          "weight": 50,
          "multiplier": 2,
          "reps": 6,
          "rpe": 7
        },
        {
          "set": 2,
          "weight": 50,
          "multiplier": 2,
          "reps": 6,
          "rpe": 8
        },
        {
          "set": 3,
          "weight": 50,
          "multiplier": 2,
          "reps": 6,
          "rpe": 9
        }
      ]
    },
    "one-arm-dumbbell-row": {
      "name": "One-Arm Dumbbell Row",
      "logType": "strength",
      "sets": [
        {
          "set": 1,
          "weight": 50,
          "reps": 8,
          "rpe": 7
        },
        {
          "set": 2,
          "weight": 50,
          "reps": 8,
          "rpe": 7
        },
        {
          "set": 3,
          "weight": 50,
          "reps": 8,
          "rpe": 7
        }
      ]
    },
    "chest-supported-dumbbell-row": {
      "name": "Chest-Supported Dumbbell Row",
      "logType": "strength",
      "sets": [
        {
          "set": 1,
          "weight": 40,
          "multiplier": 2,
          "reps": 10,
          "rpe": 7
        },
        {
          "set": 2,
          "weight": 40,
          "multiplier": 2,
          "reps": 10,
          "rpe": 7
        },
        {
          "set": 3,
          "weight": 40,
          "multiplier": 2,
          "reps": 10,
          "rpe": 7
        }
      ]
    },
    "hammer-curl": {
      "name": "Hammer Curl",
      "logType": "strength",
      "sets": [
        {
          "set": 1,
          "weight": 30,
          "multiplier": 2,
          "reps": 10,
          "rpe": 8
        },
        {
          "set": 2,
          "weight": 30,
          "multiplier": 2,
          "reps": 10,
          "rpe": 8
        }
      ]
    },
    "overhead-triceps-extension": {
      "name": "Overhead Triceps Extension",
      "logType": "strength",
      "sets": [
        {
          "set": 1,
          "weight": 30,
          "reps": 12,
          "rpe": 7
        },
        {
          "set": 2,
          "weight": 30,
          "reps": 12,
          "rpe": 7
        }
      ]
    }
  }
}